varhadi_0027.wav|त्यानं त्या दोघांले शिकवलं की कसं बगीच्यात राहायचं आणि काय करायले पाहिजे आणि ते खूप खुश होते कारण की त्यानं जे परमेश्वरानं म्हटलं तेच केलं. अजून तुम्हाले या परमेश्वराची माहिती पाहिजे जो तुमच्यावर प्रेम करतो? काय तुम्हाले त्याचं बनाचं हाय? तर ऐका आणि तुम्हाले मी आणखीन गोष्ट सांगेन.
varhadi_0028.wav|चित्र दहा: दहा आज्ञा जे दहा आज्ञा परमेश्वरानं मोशेले दिल्या होत्या, ते खूप चांगले हाय. जो कोणी त्याचं पालन करते, त्याले परमेश्वर आशीर्वाद देतो. हे परमेश्वराचे नियम हाय.  आमाले खऱ्या परमेश्वरावर प्रेम, आज्ञेचं पालन आणि आराधना केली पाहिजे. कोणीच मूर्ती बनू नका अन त्याच्यासमोर झुकू नका. विनाकारण देवाचं नाव घेऊ नका.
varhadi_0029.wav|हफ्त्यातून एक दिवस परमेश्वराच्या आराधनेसाठी एकडा ठेवा.लेकरायनं आपल्या मायबापाचं ऐकावं अन त्यांचा आदर करा.  हत्या करू नका. व्यभिचार करू नका. खोटं बोलू नका. कोनाले फसवू नका. चोरी करू नका. कोणा दुसऱ्या माणसाच्या वस्तूची लालूच धरू नका.
varhadi_0030.wav| चित्र अकरा: पापासाठी बली मुसाच्या वेळेस जो कोणी माणूस देवाच्या नियमाले नाही मानत, तवा त्याले परमेश्वरासाठी एका बकऱ्याची बली द्यावा लागत होती. बकऱ्याचं मरण ज्या माणसाच्या जागी होत होती, जेन त्या नियमाले नाही मानलं. हे इस्राईलच्या लोकानले आठवण करून देत होतं की ते परमेश्वराच्या विरुद्ध पाप करतेत, जवा ते त्या नियमाले नाही मानत.
varhadi_0031.wav|बकरा हे एक चिन्ह होतं त्या महान बलिदानाचा जे भविष्यात येणारं होतं.परमेश्वरानं ही योजना केली होती की तो त्याचा पोरगा येसुले ह्या संसारात एका बलिदानाच्या रूपात पाठवन.
varhadi_0032.wav|चित्र बारा: एक वचन देणारा मसीहा लय वर्षानंतर एक स्वर्गदूत एका तरुण कुवारीपाशी आला, तिचं नाव होतं मरिया. मरियमचा साखरपुडा एका युसुफ नावाच्या माणसासोबत झालं. त्या स्वर्गदूतानं मरियमले म्हटलं, "तू न परमेश्वराच्या नजरेस अनुग्रह प्राप्त केला हाय. तू एका पोरले जनशीन अन त्याचं नाव तू येसू ठेव."
varhadi_0033.wav|मरियमनं विचारलं, "हे कसं व्हईन? मी त अनकीन कुवारी हाय." स्वर्गदूतानं तिले म्हटलं, "पवित्र आत्मा त्यावरीन, ज्याच्यामुळे त्या पवित्र माणसाचं जन्म व्हईन, अन त्याले लोकं परमेश्वराच्या पोरासारखं जानन."  अन तोच स्वर्गदूत युसुफाच्या स्वप्नात पण आला. स्वर्गदूतानं योसेफाले म्हटलं, "तू मरियमसोबत लगीन करायले भिऊ नको, काऊन की ते पवित्र आत्म्याच्या द्वारे गरोदर झाली. ते एका पोरले जन्म दीन, त्याचं नाव तू येसू ठेव."
varhadi_0034.wav|येसूचं मतलब रक्षक. युसुफानं मरियमले आपल्या बायकोच्या रूपात स्वीकारलं, अन तो तिच्यासोबत तोपर्यंत झोपला नाही, जवापर्यंत येसूचा जन्म नाही झाला.
varhadi_0035.wav|चित्र तेरा: प्रभू येसूचा जन्म त्या वेळेस राजानं अशा प्रकारे राजानं साऱ्या लोकाले हुकूम दिल्ं की ते आपापल्या पुरुजाच्या गावाले जाऊन स्वतःचं नाव लिहावं. मरियम आणि योसेफले पण बेथलेमले जा लागलं. जवा ते बेथलेमात पोचले, त त्यानले कुठंच राहिले जागा नाही भेटली. ह्यामुळे त्यानले एका जनावराच्या गोठ्यात राहा लागलं.
varhadi_0036.wav|हेच ते जागा होती ज्या ठिकाणी मरियमनं येसुले जन्म दिल्ं.  त्याच रात्री स्वर्गदूत काही मेंढपाळासोबत प्रगट होतो, ते आपल्या मेंढराची राखणदारी करत होते. स्वर्गदूत त्यांच्यासमोर प्रगट होतो आणि म्हणतो, "मी तुमच्यासाठी एक चांगली गोष्टी आणली हाय, की ते साऱ्या लोकाईसाठी हाय. आज एक रक्षा करण्या वाल्यानं जन्म घेतला हाय, जो येसू प्रभू हाय." एका दमात आकाशात लय सारे स्वर्गदूत जमा होते, अन ते जमा होतात अन परमेश्वराची आराधना करायले लागतात.
varhadi_0037.wav|मेंढपाळ एकमेकासोबत बोलत राहतेत, "या, आपण बेथलेमात जाऊ अन काय झालं ते पाहू." जवा त्यानं येसुले पाहिलं, अन त्यानं साऱ्या लोकाले ही गोष्ट सांगितली जे त्यानं प्रभू येसूच्या बाऱ्यामध्ये ऐकलं. जवा त्यानं ह्या साऱ्या गोष्टीले ऐकलं, तवा ते लोकं हैराण झाले.
varhadi_0038.wav|चित्र चौदा: येसू एका शिक्षकासारखा येसूचं पालनपोषण योसेफाच्या घरी झालं. जवा तो बारा वर्षाचा झाला, तवा मरियम आणि योसेफानं त्याले यरुशलेमच्या मंदिरात घेऊन गेले. तिथं त्यानं परमेश्वराच्या विषयी गोष्ट केली, धर्मगुरू आणि लोकांच्या सेवकासोबत. तो त्यांच्या गोष्टीले ऐकत होता आणि लय प्रकारचे प्रश्न विचारत होता.
varhadi_0039.wav|ते लोकं प्रभू येसू मसीच्या तोंडातून निघालेल्या परमेश्वराच्या महान गोष्टी ऐकून ते हैराण झाले.  जवा येसू तीस वर्षाचा झाला, तवा त्यानं लोकाले शिकवणं सुरू केलं. लय लोकानं त्याच्या शिकवण्यावर विश्वास ठेवला अन त्याचं पालन करणं सुरू केलं. पण दुसऱ्या लोकानं त्याच्या गोष्टीवर विश्वास नाही ठेवलं अन त्याचा विरोध करायले सुरुवात केली.
varhadi_0040.wav|चित्र पंधरा: प्रभू येसूचे चमत्कार येसूच्या जवळ परमेश्वराची महान शक्ती होती. त्यानं लय चमत्कार केले. त्यानं बिमाराले बरं केलं, अन आंधळ्याले दिसायला लागलं. त्यानं मेलेल्या लोकाले डबल जिवंत केलं. त्यानं तुफानावर आपला अधिकार दाखवला अन पाण्यावर चालला.
varhadi_0041.wav|जवा लोकानं त्याच्या चमत्काराले पाहिलं, तवा लय साऱ्या लोकानं त्याच्यावर विश्वास केला अन हे म्हटलं की हा परमेश्वराकडून आला हाय. ते लोक हैराण होते प्रभू येसू मसीच्या मुळे केलेल्या कामापासून व ऐकलेल्या गोष्टीपासून. येसूपाशी शक्ती हाय आपले पण मदत करायले.
varhadi_0042.wav|चित्र सोळा: त्रास प्रभू येसू मसीचे प्रभू येसू मसीनं लय चांगले काम केले अन लय सारे लोकं त्याच्याप्रमाणे चालले. त्यानं लय लोकायची मदत केली अन कितीतरी लोकाले परमेश्वराच्या खऱ्या रस्त्यावर त्यानं चालवलं. प्रभू येसू मसी ह्या संसारात याच्यासाठी आला, तो परमेश्वराच्या प्रेमाले लोकाले दाखवन.
varhadi_0043.wav|अन वाईट कामात अन पापात फसलेल्या लोकाले परमेश्वराजवळ वापस घेऊन यायसाठी. परंतु धर्मगुरू त्याच्यावर जळत होते, काऊन की त्यांचं मन गोट्यासारखं होतं. अन ते ह्या गोष्टीवर विश्वास ठेवत नव्हते की प्रभू येसू मसी परमेश्वराकडून पाठवलेला हाय. ते ह्या गोष्टी कबूल करत नव्हते अन त्यानं देवाचं नियम तोडलं अन ते पापी हाय.
varhadi_0044.wav|त्या सेवकांना येसू मसीच्या विषयी खोटं बोलून त्याले पकडायला लावलं.  शिपायानं त्याले फटके मारले अन त्यानं त्याच्या डोक्यावर काट्याचं मुकुट ठेवलं अन त्याची मजा उडू लागले. हे ध्यानात ठेवा की येसू मसी देवाचा पोरगा होय. त्याच्याजवळ ते शक्ती हाय की त्या लोकानले तो सत्यानाश करन. पण त्यानं त्यानले थांबवलं नाही, काऊन की त्याले माहीत होतं की हे परमेश्वराची योजना हाय.
varhadi_0045.wav|चित्र सतरा: प्रभू येसू मसीले क्रुसावर चढवणं सैनिकांना प्रभू येसू मसीले लाकडाच्या क्रुसावर खिळ्यात लटकवलं, अन त्याले तसंच सोडलं जोपर्यंत तो मरत नाही. त्या वेळेस अशी पद्धत होती की जो कोणी नियमाले तोडतेत अन त्याले अशाच प्रकारचं भयानक मरण भेटते. दोन अपराध्याले येसू मसीच्या जवळच क्रुसावर चढवल्या गेलं होतं.
varhadi_0046.wav|पण प्रभू येसू मसी गुन्हेगार नव्हता. त्यानं काही पण चुकीचं काम नाही केलं.  प्रभू येसू मसीनं आपल्या शिक्षेले स्वतःवर घेतलं. आपण साऱ्यानं पाप केलं हाय अन आपल्या साऱ्याले मरणच हाय आपल्या पापामुळे. पण प्रभू येसू मसीनं आपल्या पापासाठी त्यानं स्वतःले बली करून दिल्ं. जर आपण लोकं हे कबूल करू की आपण पापी हाव, अन जर परमेश्वराच्या इकडे आलो अन त्याले माफी मागतली, तर तो आपले माफ करन. प्रभू येसू मसीवर विश्वास ठेवा, तरच तुम्ही वाचान.
varhadi_0047.wav|चित्र अठरा: डबल जिवंत होणं येसूच्या दुश्मनाईनं अशा प्रकारे विचार केला की त्यानं त्याले नाश करून टाकलं, पण असं झालं नाही. प्रभू येसू क्रुसावर मेल्यानंतर, त्याच्या दोस्तईनं त्याच्या शरीराले एका गुफ्यात ठेवलं, अन त्या गुफ्याच्या दरवाजावर एक मोठा गोटा ठेवला. दोन दिवसाच्या नंतर, तिसऱ्या दिवशी येसू मसी डबल जिवंत झाला.  काही बाया त्या गुफेजवळ गेल्या, काऊन की गाडण्याच्या पद्धतीले पूर्ण करावं म्हणून.
varhadi_0048.wav|त्यानं त्या गोट्याले गुफ्याच्या दरवाजापासून सरकलेलं पाहिलं अन पाहिलं की प्रभू येसू मसीचं शरीर तिथे नाही हाय. अन दोन स्वर्गदूत त्यांच्यासमोर प्रगट झाले आणि त्यानं त्याले म्हटलं, "येसू जिता हाय." त्यानं म्हटलं, "तो इथं नाही हाय. तो जिता झाला हाय. हा, येसू जिता झाला हाय मेल्यातून. तो खरंच परमेश्वर हाय."  येसू जिवंत हाय. त्यानं शैतानावर आणि मरणावर विजय मिळवला हाय.
varhadi_0049.wav|चित्र एकोणीस: थोमाचं विश्वास करणं प्रभू येसू डबल जिता झाल्यानंतर, तो आपल्या चेल्यासमोर प्रगट झाला. तो त्याच्यासोबत बोलला अन त्याच्यासोबत जेवला पण. एक चेला ज्याचं नाव थोमा होतं, तो त्या वेळेस त्याच्यासोबत नव्हता. त्यानं त्या गोष्टीवर विश्वास नाही ठेवलं की प्रभू येसू मसी डबल जिता झाला हाय. त्यानं असं म्हटलं की जवापर्यंत मी प्रभू येसू मसीच्या हातात लागलेल्या जखमेले नाही पायन अन त्याले स्पर्श नाही करन, तवापर्यंत मी ह्या गोष्टीवर विश्वास नाही ठेवन की येसू मसी मेल्यातून डबल जिता झाला हाय.
varhadi_0050.wav|एका हफ्त्यानंतर येसू मसी डबल आपल्या चेल्यासमोर प्रगट झाला, तवा तिथं थोमा पण होता. जसं की तुम्ही ह्या चित्रात पाहू शकता, थोमा प्रभू येसू मसीच्या पायावर पडला आणि म्हणायला लागला, "माय प्रभू, माय परमेश्वर." अन मग कधीच थोमानं शक नाही केलं प्रभू येसू मसीच्या डबल जिवंत झाल्यावर.  येसूनं त्याले म्हटलं, "तूनं मायेवर विश्वास ठेवला की तूनं मले पाहिला हाय. पण धन्य हाय ते लोकं जे मले नाही पाहिल्यावर पण विश्वास ठेवतीन."
varhadi_0051.wav|चित्र वीस: स्वर्गात जाणं प्रभू येसू मसी मेल्यातून जिता झाल्यावर, तो लय लोकायसमोर प्रगट झाला. चाळीस दिवसानंतर प्रभू येसू मसीची स्वर्गात जायची वेळ आली, काऊन की जे काम करायले ह्या संसारात तो आला होता, ते त्यानं करून टाकलं होतं. मग प्रभू येसू मसीनं आपल्या चेल्याले म्हटलं, "जा, साऱ्या देशात चेल्याले बनवा, अन त्यानले साऱ्या गोष्टी जे मी तुमाले शिकवल्या, पालन करणं शिकवा."  ज्याप्रमाणं चेले त्याले पाहत होते, प्रभू येसू मसी धरतीले सोडून आकाशात जायले लागला
varhadi_0052.wav|अन हळूहळू ढगात गायब झाला. अन त्याच्याच नंतर दोन स्वर्गदूत तिथं प्रगट झाले. त्यानं चेल्याले असं म्हटलं, "जसं येसुले तुम्ही स्वर्गात जातांनी पाहत हाय, एक दीस येसू वापस तसंच डबल ह्या संसारात येईन."  येसू मसी आता स्वर्गात हाय, अन तो तिथं त्या लोकासाठी जागा तयार करत हाय जे प्रभू येसू मसीचं अनुसरण करते. काय तुम्ही प्रभू येसू मसीवर विश्वास अन त्याचं अनुसरण करान काय? काय तुम्ही तयार हाय त्याले भेटायले, जवा तो वापस येईन?
varhadi_0053.wav|चित्र एकवीस: खाली क्रूस येसू मसी क्रुसावर काऊन मेला? प्रभू येसू मसी अशासाठी मेला की पापी लोक त्याच्या शिक्षेपासून वाचवले जावे. येसू मसीनं कधी पाप नाही केलं. क्रूस आमाले हे आठवण करून देते की तो याच्यासाठी मेला की त्या पापाले आमच्यापासून दूर करावं, ज्यामुळे आपण परमेश्वरापासून दूर होतो.  येसू पवित्र आणि पापापासून अलग होता.
varhadi_0054.wav|चित्र बावीस: दोन रस्ते प्रभू येसूनं सार्वकालिक जीवनाविषयी शिकवलं. हरेक जण पापाच्या मोठ्या रस्त्यापासून सुरुवात करते, कारण की आपल्या साऱ्यामध्ये पापाचा स्वभाव हाय, जो आमाले आदमापासून भेटलेला हाय. लहान रस्ता आमाले स्वर्गाच्या सार्वकालिक जीवनाकडे घेऊन जाते जे परमेश्वराकडून हाय.  येसूनं म्हटलं की आपले मोठ्या रस्त्याले सोडून लहान रस्त्यानं आपले चाललं पाहिजे. आपण पाहू शकतो ह्या चित्रामध्ये की एका क्रुसाले एका लहान रस्त्यावर ठेवलं हाय. आम्ही त्या रस्त्यावर जवा जातो, जवा आपण आपल्या पापाची कबुली करतो, अन आपल्या पापाले मागं सोडून येसू मसीच्या मरणावर विश्वास करतो. कितीतरी सारे लोकं आपल्या पापाच्या जीवनाले सोडायला तयार नसते.
